{
  "job_id": "zero-work-owner",
  "owner_bot": "grok-bot",
  "repo": "TinkerandScribe/gxp",
  "lane": "cursor",
  "protocol": "gxp-full",
  "isc": [
    {
      "id": "isc-1",
      "tag": "outcome",
      "text": "This criterion has no work task.",
      "owner_bot": "cursor-agent",
      "status": "pending",
      "sealed_by": null
    }
  ],
  "tasks": [
    {
      "id": "validate-1",
      "type": "validate",
      "depends_on": [],
      "covers_isc": ["isc-1"]
    }
  ],
  "verify_cmds": ["bash scripts/verify.sh"],
  "evidence_refs": [],
  "clock": "τ2",
  "decision": "none",
  "digest_id": "zero-work-owner",
  "pr_url": "",
  "rating": null
}
